{
  "$schema": "./catalog.schema.json",
  "schemaVersion": 1,
  "updated": "2026-10-20",
  "metadataLicense": "CC0-1.0",
  "sources": [
    {
      "id": "kenney-interface",
      "title": "Interface Sounds 1.0",
      "creator": "Kenney",
      "url": "https://kenney.nl/assets/interface-sounds",
      "downloadUrl": "https://kenney.nl/media/pages/assets/interface-sounds/fa43c1dd4d-1677589452/kenney_interface-sounds.zip",
      "license": "CC0-1.0",
      "licenseUrl": "https://creativecommons.org/publicdomain/zero/1.0/",
      "bundledLicense": "licenses/kenney-interface.txt",
      "evidence": "docs/kenney-interface-review.json",
      "checkedOn": "2026-10-20",
      "redistributionVerified": true,
      "archiveSha256": "f2193d072726d6758a5f7871b2dcc54dcce0d5c35c6f0a62f92549b327c81232"
    }
  ],
  "sounds": [
    {
      "id": "kenney-interface-back-001",
      "title": "Back 001",
      "category": "Back",
      "tags": [
        "interface",
        "ui",
        "game",
        "back",
        "return",
        "navigation"
      ],
      "creator": "Kenney",
      "sourceId": "kenney-interface",
      "sourceUrl": "https://kenney.nl/assets/interface-sounds",
      "license": "CC0-1.0",
      "path": "audio/kenney-interface/back_001.ogg",
      "originalFilename": "back_001.ogg",
      "sha256": "07db973f79f6ae0f2edc34561e7592e24d0577455919fb602cb8ecc0da991dcf",
      "bytes": 6997,
      "sampleRate": 44100,
      "channels": 1,
      "durationSeconds": 0.063878
    },
    {
      "id": "kenney-interface-back-002",
      "title": "Back 002",
      "category": "Back",
      "tags": [
        "interface",
        "ui",
        "game",
        "back",
        "return",
        "navigation"
      ],
      "creator": "Kenney",
      "sourceId": "kenney-interface",
      "sourceUrl": "https://kenney.nl/assets/interface-sounds",
      "license": "CC0-1.0",
      "path": "audio/kenney-interface/back_002.ogg",
      "originalFilename": "back_002.ogg",
      "sha256": "61581c58194e3f19f531072edabbc344204c7e0a2887b8ededce4357bcf09195",
      "bytes": 7029,
      "sampleRate": 44100,
      "channels": 1,
      "durationSeconds": 0.069841
    },
    {
      "id": "kenney-interface-back-003",
      "title": "Back 003",
      "category": "Back",
      "tags": [
        "interface",
        "ui",
        "game",
        "back",
        "return",
        "navigation"
      ],
      "creator": "Kenney",
      "sourceId": "kenney-interface",
      "sourceUrl": "https://kenney.nl/assets/interface-sounds",
      "license": "CC0-1.0",
      "path": "audio/kenney-interface/back_003.ogg",
      "originalFilename": "back_003.ogg",
      "sha256": "ff5e87de1230b1a5f1fa83e5a4ba9d7eb1c07154267ac34b510a17d4caa03cef",
      "bytes": 7208,
      "sampleRate": 44100,
      "channels": 1,
      "durationSeconds": 0.09288
    },
    {
      "id": "kenney-interface-back-004",
      "title": "Back 004",
      "category": "Back",
      "tags": [
        "interface",
        "ui",
        "game",
        "back",
        "return",
        "navigation"
      ],
      "creator": "Kenney",
      "sourceId": "kenney-interface",
      "sourceUrl": "https://kenney.nl/assets/interface-sounds",
      "license": "CC0-1.0",
      "path": "audio/kenney-interface/back_004.ogg",
      "originalFilename": "back_004.ogg",
      "sha256": "c22e3c49f42c2a5ba6748e91283efe124f32822469c1258c3e5d7b3d7ab9361c",
      "bytes": 6923,
      "sampleRate": 44100,
      "channels": 1,
      "durationSeconds": 0.072993
    },
    {
      "id": "kenney-interface-bong-001",
      "title": "Bong 001",
      "category": "Bong",
      "tags": [
        "interface",
        "ui",
        "game",
        "bong",
        "bell",
        "notification"
      ],
      "creator": "Kenney",
      "sourceId": "kenney-interface",
      "sourceUrl": "https://kenney.nl/assets/interface-sounds",
      "license": "CC0-1.0",
      "path": "audio/kenney-interface/bong_001.ogg",
      "originalFilename": "bong_001.ogg",
      "sha256": "d21d0f0b782445db579d11e2506b24cd1ac9d664ee33aeaf807761aa7b6fd710",
      "bytes": 4848,
      "sampleRate": 44100,
      "channels": 1,
      "durationSeconds": 0.122834
    },
    {
      "id": "kenney-interface-click-001",
      "title": "Click 001",
      "category": "Click",
      "tags": [
        "interface",
        "ui",
        "game",
        "click",
        "button",
        "tap"
      ],
      "creator": "Kenney",
      "sourceId": "kenney-interface",
      "sourceUrl": "https://kenney.nl/assets/interface-sounds",
      "license": "CC0-1.0",
      "path": "audio/kenney-interface/click_001.ogg",
      "originalFilename": "click_001.ogg",
      "sha256": "ccfb7fa0cccdd9faec0eb16033c732b1e308d139d80f799161495d58f7adcdb9",
      "bytes": 4876,
      "sampleRate": 44100,
      "channels": 1,
      "durationSeconds": 0.100023
    },
    {
      "id": "kenney-interface-click-002",
      "title": "Click 002",
      "category": "Click",
      "tags": [
        "interface",
        "ui",
        "game",
        "click",
        "button",
        "tap"
      ],
      "creator": "Kenney",
      "sourceId": "kenney-interface",
      "sourceUrl": "https://kenney.nl/assets/interface-sounds",
      "license": "CC0-1.0",
      "path": "audio/kenney-interface/click_002.ogg",
      "originalFilename": "click_002.ogg",
      "sha256": "adcd1f4adc35f1b41bc1b5bbefeff7aa44f2f3f0d96d3199b544140c7c1e761c",
      "bytes": 4275,
      "sampleRate": 44100,
      "channels": 1,
      "durationSeconds": 0.010023
    },
    {
      "id": "kenney-interface-click-003",
      "title": "Click 003",
      "category": "Click",
      "tags": [
        "interface",
        "ui",
        "game",
        "click",
        "button",
        "tap"
      ],
      "creator": "Kenney",
      "sourceId": "kenney-interface",
      "sourceUrl": "https://kenney.nl/assets/interface-sounds",
      "license": "CC0-1.0",
      "path": "audio/kenney-interface/click_003.ogg",
      "originalFilename": "click_003.ogg",
      "sha256": "2fa929138bc3a0f432696588f66eac94b8f6d463905ec8808c6461ce4b054292",
      "bytes": 4371,
      "sampleRate": 44100,
      "channels": 1,
      "durationSeconds": 0.010023
    },
    {
      "id": "kenney-interface-click-004",
      "title": "Click 004",
      "category": "Click",
      "tags": [
        "interface",
        "ui",
        "game",
        "click",
        "button",
        "tap"
      ],
      "creator": "Kenney",
      "sourceId": "kenney-interface",
      "sourceUrl": "https://kenney.nl/assets/interface-sounds",
      "license": "CC0-1.0",
      "path": "audio/kenney-interface/click_004.ogg",
      "originalFilename": "click_004.ogg",
      "sha256": "09e2c1b643b71b9aff9932b4e02d78db116446b9a14b00a5b2a9b28d2668fd8e",
      "bytes": 4486,
      "sampleRate": 44100,
      "channels": 1,
      "durationSeconds": 0.010023
    },
    {
      "id": "kenney-interface-click-005",
      "title": "Click 005",
      "category": "Click",
      "tags": [
        "interface",
        "ui",
        "game",
        "click",
        "button",
        "tap"
      ],
      "creator": "Kenney",
      "sourceId": "kenney-interface",
      "sourceUrl": "https://kenney.nl/assets/interface-sounds",
      "license": "CC0-1.0",
      "path": "audio/kenney-interface/click_005.ogg",
      "originalFilename": "click_005.ogg",
      "sha256": "a3ee7ebb036bc3cdc218ae52bb27548c4f49bcf07505274f8b61b1af8236acc2",
      "bytes": 4410,
      "sampleRate": 44100,
      "channels": 1,
      "durationSeconds": 0.010023
    },
    {
      "id": "kenney-interface-close-001",
      "title": "Close 001",
      "category": "Close",
      "tags": [
        "interface",
        "ui",
        "game",
        "close",
        "dismiss",
        "window"
      ],
      "creator": "Kenney",
      "sourceId": "kenney-interface",
      "sourceUrl": "https://kenney.nl/assets/interface-sounds",
      "license": "CC0-1.0",
      "path": "audio/kenney-interface/close_001.ogg",
      "originalFilename": "close_001.ogg",
      "sha256": "44af8249b933e0fd35ec957a638bb1a0b01f85b53fbe9674bf77bd3ca3168ef4",
      "bytes": 9915,
      "sampleRate": 44100,
      "channels": 1,
      "durationSeconds": 0.147778
    },
    {
      "id": "kenney-interface-close-002",
      "title": "Close 002",
      "category": "Close",
      "tags": [
        "interface",
        "ui",
        "game",
        "close",
        "dismiss",
        "window"
      ],
      "creator": "Kenney",
      "sourceId": "kenney-interface",
      "sourceUrl": "https://kenney.nl/assets/interface-sounds",
      "license": "CC0-1.0",
      "path": "audio/kenney-interface/close_002.ogg",
      "originalFilename": "close_002.ogg",
      "sha256": "bc4279d2bb2bf86592473eab6a8eab55e51b54a8619315000dbd780a83b102d8",
      "bytes": 14752,
      "sampleRate": 44100,
      "channels": 1,
      "durationSeconds": 0.313787
    },
    {
      "id": "kenney-interface-close-003",
      "title": "Close 003",
      "category": "Close",
      "tags": [
        "interface",
        "ui",
        "game",
        "close",
        "dismiss",
        "window"
      ],
      "creator": "Kenney",
      "sourceId": "kenney-interface",
      "sourceUrl": "https://kenney.nl/assets/interface-sounds",
      "license": "CC0-1.0",
      "path": "audio/kenney-interface/close_003.ogg",
      "originalFilename": "close_003.ogg",
      "sha256": "39a1a7f3bc001766c1881841e9903c6b16f5a10b5666e0791d7f6444677d8b05",
      "bytes": 15648,
      "sampleRate": 44100,
      "channels": 1,
      "durationSeconds": 0.313787
    },
    {
      "id": "kenney-interface-close-004",
      "title": "Close 004",
      "category": "Close",
      "tags": [
        "interface",
        "ui",
        "game",
        "close",
        "dismiss",
        "window"
      ],
      "creator": "Kenney",
      "sourceId": "kenney-interface",
      "sourceUrl": "https://kenney.nl/assets/interface-sounds",